{
  "$schema": "https://json-schema.org/draft/2020-12/schema",
  "$id": "https://legalise.dev/schemas/module.json",
  "title": "Module Manifest",
  "description": "Manifest for a Legalise workspace module. Every module ships one of these at the root of its backend directory.",
  "type": "object",
  "required": ["name", "version", "description", "nav", "routes"],
  "properties": {
    "name": {
      "type": "string",
      "pattern": "^[a-z][a-z0-9-]*[a-z0-9]$",
      "description": "Kebab-case public identifier. Used in routes, navigation, and discovery."
    },
    "version": {
      "type": "string",
      "pattern": "^[0-9]+\\.[0-9]+\\.[0-9]+(-[a-zA-Z0-9.-]+)?$",
      "description": "Semantic version of the module itself, independent of Legalise core."
    },
    "description": {
      "type": "string",
      "minLength": 10,
      "description": "One sentence on what this module does for a matter."
    },
    "author": {
      "type": "string",
      "description": "GitHub handle, name, or organisation."
    },
    "license": {
      "type": "string",
      "description": "SPDX identifier. Apache-2.0 recommended for upstream contributions."
    },
    "homepage": {
      "type": "string",
      "format": "uri"
    },
    "nav": {
      "type": "object",
      "required": ["label", "order"],
      "properties": {
        "label": {
          "type": "string",
          "description": "Text shown in the matter sidebar."
        },
        "icon": {
          "type": "string",
          "description": "Optional icon reference (lucide:icon-name or a custom URL)."
        },
        "order": {
          "type": "integer",
          "minimum": 0,
          "maximum": 999,
          "description": "Sort order in the navigation. 10-50 reserved for built-in tabs. Third-party defaults to 60+."
        }
      },
      "additionalProperties": false
    },
    "routes": {
      "type": "object",
      "required": ["backend_prefix", "frontend_route"],
      "properties": {
        "backend_prefix": {
          "type": "string",
          "pattern": "^/api/modules/[a-z][a-z0-9-]*[a-z0-9]$",
          "description": "Path prefix for the module's FastAPI router."
        },
        "frontend_route": {
          "type": "string",
          "description": "TanStack Router route pattern. Use $slug for the matter slug placeholder."
        }
      },
      "additionalProperties": false
    },
    "requires": {
      "type": "object",
      "properties": {
        "plugins": {
          "type": "array",
          "items": {
            "type": "string",
            "description": "Plugin slug from the claude-for-uk-legal marketplace (e.g. 'uk-litigation-legal:pre-motion')."
          }
        },
        "env": {
          "type": "array",
          "items": {
            "type": "string",
            "description": "Required environment variable name."
          }
        },
        "mcp_servers": {
          "type": "array",
          "items": {
            "type": "string",
            "description": "Required MCP server. Module fails to load if not configured."
          }
        },
        "core_version": {
          "type": "string",
          "description": "SemVer range of Legalise core this module is compatible with. Defaults to caret of current minor."
        }
      },
      "additionalProperties": false
    },
    "permissions": {
      "type": "array",
      "items": {
        "type": "string",
        "enum": [
          "matter.read",
          "matter.write",
          "documents.read",
          "documents.write",
          "audit.read",
          "audit.write",
          "model.call",
          "plugins.invoke"
        ]
      },
      "description": "Permissions the module requires. Audit and model-call permissions are granted by default to all modules; explicit declaration is preferred."
    },
    "capabilities": {
      "type": "array",
      "uniqueItems": true,
      "items": {
        "type": "string",
        "enum": [
          "matter.read",
          "document.body.read",
          "document.generated.write",
          "model.invoke",
          "chronology.read",
          "chronology.write",
          "citation.write",
          "audit.emit"
        ]
      },
      "description": "Declared capabilities the module exercises. v0.1 surfaces these as declarations under review; runtime per-capability enforcement is v0.2."
    },
    "trust_posture": {
      "type": "string",
      "enum": ["trusted", "third_party", "experimental"],
      "description": "Trust band for the module. Surfaced in the Modules page; declarative only in v0.1."
    },
    "skills": {
      "type": "object",
      "description": "Per-skill overrides. Keys are skill slugs (match the SKILL.md frontmatter `name`). When a skill is present here, its `capabilities` and `trust_posture` replace the plugin-level defaults for that skill. Skills absent from this map inherit the plugin-level values.",
      "patternProperties": {
        "^[a-z][a-z0-9-]*[a-z0-9]$": {
          "type": "object",
          "properties": {
            "capabilities": {
              "type": "array",
              "uniqueItems": true,
              "items": {
                "type": "string",
                "enum": [
                  "matter.read",
                  "document.body.read",
                  "document.generated.write",
                  "model.invoke",
                  "chronology.read",
                  "chronology.write",
                  "citation.write",
                  "audit.emit"
                ]
              }
            },
            "trust_posture": {
              "type": "string",
              "enum": ["trusted", "third_party", "experimental"]
            }
          },
          "additionalProperties": false
        }
      },
      "additionalProperties": false
    },
    "metadata": {
      "type": "object",
      "description": "Free-form module-specific metadata.",
      "additionalProperties": true
    }
  },
  "additionalProperties": false
}
