{
  "name": "uk-employment-legal",
  "version": "0.1.0",
  "description": "UK employment law skills. Pre-action correspondence, unfair-dismissal screening, and settlement-agreement review.",
  "author": "b1rdmania",
  "license": "Apache-2.0",
  "homepage": "https://github.com/b1rdmania/claude-for-uk-legal",
  "nav": {
    "label": "Employment",
    "icon": "lucide:briefcase",
    "order": 60
  },
  "routes": {
    "backend_prefix": "/api/modules/uk-employment-legal",
    "frontend_route": "/matters/$slug/employment"
  },
  "capabilities": [
    "matter.read",
    "document.body.read",
    "document.generated.write",
    "model.invoke"
  ],
  "trust_posture": "trusted",
  "skills": {
    "lba-drafter": {
      "capabilities": [
        "matter.read",
        "document.body.read",
        "document.generated.write",
        "model.invoke"
      ]
    },
    "unfair-dismissal-screener": {
      "capabilities": [
        "matter.read",
        "document.body.read",
        "model.invoke"
      ]
    },
    "settlement-agreement-review": {
      "capabilities": [
        "matter.read",
        "document.body.read",
        "document.generated.write",
        "model.invoke"
      ]
    }
  }
}
